{"architecture_specific":false,"canonical":true,"construction_partition_counts":{"train":110000},"construction_population":"fixed seed-42 training split only","derivation_version":"training-type7-05-95-ten-equal-v1","interval_policy":{"adjacent_boundaries_shared":true,"count":10,"equal_width_in":"standardized_space","lower_inclusive":true,"upper_inclusive":true},"normalization_source":{"repository_path":"data/phase1/asset-inventory.json","sha256":"30794abfa7d3e09d23e42fce050cb0bbfca77db36e8f7f2c51db268de0f0effb","standard_deviation_definition":"sample; correction=1; n=110000"},"properties":[{"physical_interval_width":"0.1980988649166800","physical_unit":"eV","property":"homo","q0_05_standardized":"-1.5634805885686038070603655970153279438969536220289883653994101063788142805154105","q0_95_standardized":"1.7482826105021051111999751731285821970272953599202000901716037224497555137892397","ranges":[{"lower_inclusive":true,"physical_lower":"-7.4722456464451000","physical_upper":"-7.2741467815284200","range_index":1,"standardized_lower":"-1.5634805885686038070603655970153279438969536220289883653994101063788142805154105","standardized_upper":"-1.2323042686615329152343315200009369298045287238340695198423087234959573010849455","upper_inclusive":true},{"lower_inclusive":true,"physical_lower":"-7.2741467815284200","physical_upper":"-7.0760479166117400","range_index":2,"standardized_lower":"-1.2323042686615329152343315200009369298045287238340695198423087234959573010849455","standardized_upper":"-0.90112794875446202340829744298654591571210382563915067428520734061310032165448046","upper_inclusive":true},{"lower_inclusive":true,"physical_lower":"-7.0760479166117400","physical_upper":"-6.8779490516950600","range_index":3,"standardized_lower":"-0.90112794875446202340829744298654591571210382563915067428520734061310032165448046","standardized_upper":"-0.56995162884739113158226336597215490161967892744423182872810595773024334222401544","upper_inclusive":true},{"lower_inclusive":true,"physical_lower":"-6.8779490516950600","physical_upper":"-6.6798501867783800","range_index":4,"standardized_lower":"-0.56995162884739113158226336597215490161967892744423182872810595773024334222401544","standardized_upper":"-0.2387753089403202397562292889577638875272540292493129831710045748473863627935504","upper_inclusive":true},{"lower_inclusive":true,"physical_lower":"-6.6798501867783800","physical_upper":"-6.4817513218617000","range_index":5,"standardized_lower":"-0.2387753089403202397562292889577638875272540292493129831710045748473863627935504","standardized_upper":"0.0924010109667506520698047880566271265651708689456058623860968080354706166369146","upper_inclusive":true},{"lower_inclusive":true,"physical_lower":"-6.4817513218617000","physical_upper":"-6.2836524569450200","range_index":6,"standardized_lower":"0.0924010109667506520698047880566271265651708689456058623860968080354706166369146","standardized_upper":"0.4235773308738215438958388650710181406575957671405247079431981909183275960673796","upper_inclusive":true},{"lower_inclusive":true,"physical_lower":"-6.2836524569450200","physical_upper":"-6.0855535920283400","range_index":7,"standardized_lower":"0.4235773308738215438958388650710181406575957671405247079431981909183275960673796","standardized_upper":"0.7547536507808924357218729420854091547500206653354435535002995738011845754978446","upper_inclusive":true},{"lower_inclusive":true,"physical_lower":"-6.0855535920283400","physical_upper":"-5.8874547271116600","range_index":8,"standardized_lower":"0.7547536507808924357218729420854091547500206653354435535002995738011845754978446","standardized_upper":"1.0859299706879633275479070190998001688424455635303623990574009566840415549283097","upper_inclusive":true},{"lower_inclusive":true,"physical_lower":"-5.8874547271116600","physical_upper":"-5.6893558621949800","range_index":9,"standardized_lower":"1.0859299706879633275479070190998001688424455635303623990574009566840415549283097","standardized_upper":"1.4171062905950342193739410961141911829348704617252812446145023395668985343587747","upper_inclusive":true},{"lower_inclusive":true,"physical_lower":"-5.6893558621949800","physical_upper":"-5.4912569972783000","range_index":10,"standardized_lower":"1.4171062905950342193739410961141911829348704617252812446145023395668985343587747","standardized_upper":"1.7482826105021051111999751731285821970272953599202000901716037224497555137892397","upper_inclusive":true}],"standardized_interval_width":"0.33117631990707089182603407701439101409242489819491884555710138288285697943046502","training_mean":"-6.537022590637207","training_sample_standard_deviation":"0.598167359828949"},{"physical_interval_width":"0.4019121201674950","physical_unit":"eV","property":"lumo","q0_05_standardized":"-1.6447351966111977841008698253447979153886458227950348572256967963352055547578637","q0_95_standardized":"1.5103312922273165885384157567792969160196727210899889116775366517225959352443560","ranges":[{"lower_inclusive":true,"physical_lower":"-1.7741821418362000","physical_upper":"-1.3722700216687050","range_index":1,"standardized_lower":"-1.6447351966111977841008698253447979153886458227950348572256967963352055547578637","standardized_upper":"-1.3292285477273463468369412671323884322478139684065324803353734515294254057576417","upper_inclusive":true},{"lower_inclusive":true,"physical_lower":"-1.3722700216687050","physical_upper":"-0.9703579015012100","range_index":2,"standardized_lower":"-1.3292285477273463468369412671323884322478139684065324803353734515294254057576417","standardized_upper":"-1.0137218988434949095730127089199789491069821140180301034450501067236452567574198","upper_inclusive":true},{"lower_inclusive":true,"physical_lower":"-0.9703579015012100","physical_upper":"-0.5684457813337150","range_index":3,"standardized_lower":"-1.0137218988434949095730127089199789491069821140180301034450501067236452567574198","standardized_upper":"-0.69821524995964347230908415070756946596615025962952772655472676191786510775719779","upper_inclusive":true},{"lower_inclusive":true,"physical_lower":"-0.5684457813337150","physical_upper":"-0.1665336611662200","range_index":4,"standardized_lower":"-0.69821524995964347230908415070756946596615025962952772655472676191786510775719779","standardized_upper":"-0.3827086010757920350451555924951599828253184052410253496644034171120849587569758","upper_inclusive":true},{"lower_inclusive":true,"physical_lower":"-0.1665336611662200","physical_upper":"0.2353784590012750","range_index":5,"standardized_lower":"-0.3827086010757920350451555924951599828253184052410253496644034171120849587569758","standardized_upper":"-0.0672019521919405977812270342827504996844865508525229727740800723063048097567539","upper_inclusive":true},{"lower_inclusive":true,"physical_lower":"0.2353784590012750","physical_upper":"0.6372905791687700","range_index":6,"standardized_lower":"-0.0672019521919405977812270342827504996844865508525229727740800723063048097567539","standardized_upper":"0.2483046966919108394827015239296589834563453035359794041162432724994753392434681","upper_inclusive":true},{"lower_inclusive":true,"physical_lower":"0.6372905791687700","physical_upper":"1.0392026993362650","range_index":7,"standardized_lower":"0.2483046966919108394827015239296589834563453035359794041162432724994753392434681","standardized_upper":"0.5638113455757622767466300821420684665971771579244817810065666173052554882436901","upper_inclusive":true},{"lower_inclusive":true,"physical_lower":"1.0392026993362650","physical_upper":"1.4411148195037600","range_index":8,"standardized_lower":"0.5638113455757622767466300821420684665971771579244817810065666173052554882436901","standardized_upper":"0.8793179944596137140105586403544779497380090123129841578968899621110356372439121","upper_inclusive":true},{"lower_inclusive":true,"physical_lower":"1.4411148195037600","physical_upper":"1.8430269396712550","range_index":9,"standardized_lower":"0.8793179944596137140105586403544779497380090123129841578968899621110356372439121","standardized_upper":"1.1948246433434651512744871985668874328788408667014865347872133069168157862441340","upper_inclusive":true},{"lower_inclusive":true,"physical_lower":"1.8430269396712550","physical_upper":"2.2449390598387500","range_index":10,"standardized_lower":"1.1948246433434651512744871985668874328788408667014865347872133069168157862441340","standardized_upper":"1.5103312922273165885384157567792969160196727210899889116775366517225959352443560","upper_inclusive":true}],"standardized_interval_width":"0.31550664888385143726392855821240948314083185438850237689032334480578014900022197","training_mean":"0.32098451256752014","training_sample_standard_deviation":"1.273862600326538"},{"physical_interval_width":"0.41036125444725175","physical_unit":"eV","property":"gap","q0_05_standardized":"-1.6102185783393980500451480462222570398979562293339314825281344500315533715565960","q0_95_standardized":"1.5879711696499355154957558735441113850134385048762483421709624587271650347812165","ranges":[{"lower_inclusive":true,"physical_lower":"4.79192446591035000","physical_upper":"5.20228572035760175","range_index":1,"standardized_lower":"-1.6102185783393980500451480462222570398979562293339314825281344500315533715565960","standardized_upper":"-1.2903996035404646934910576542456201974068167559129135000582247591556815309228148","upper_inclusive":true},{"lower_inclusive":true,"physical_lower":"5.20228572035760175","physical_upper":"5.61264697480485350","range_index":2,"standardized_lower":"-1.2903996035404646934910576542456201974068167559129135000582247591556815309228148","standardized_upper":"-0.97058062874153133693696726226898335491567728249189551758831506827980969028903350","upper_inclusive":true},{"lower_inclusive":true,"physical_lower":"5.61264697480485350","physical_upper":"6.02300822925210525","range_index":3,"standardized_lower":"-0.97058062874153133693696726226898335491567728249189551758831506827980969028903350","standardized_upper":"-0.650761653942597980382876870292346512424